{"experiment_id": "exp_1775601757_0045", "timestamp": "2026-04-07T22:42:37.295260", "area": "memory_retrieval", "score": 0.7799813087715044, "quality": 0.8225, "latency_ms": 4886.672884225845, "reliability": 1.0, "status": "discard", "description": "memory: increase top_k 5 -> 7", "mutation": {"description": "memory: increase top_k 5 -> 7"}}
{"experiment_id": "exp_1775602100_0046", "timestamp": "2026-04-07T22:48:20.453279", "area": "voice_params", "score": 0.7898266218437089, "quality": 0.8375, "latency_ms": 4856.24161362648, "reliability": 1.0, "status": "discard", "description": "voice: smaller TTS chunks 40 -> 30 (lower latency)", "mutation": {"description": "voice: smaller TTS chunks 40 -> 30 (lower latency)"}}
{"experiment_id": "exp_1775602431_0047", "timestamp": "2026-04-07T22:53:51.444053", "area": "tool_params", "score": 0.8360945072372754, "quality": 0.94125, "latency_ms": 5431.597739458084, "reliability": 1.0, "status": "discard", "description": "tools: tighten timeout 10s -> 8s (fail fast)", "mutation": {"description": "tools: tighten timeout 10s -> 8s (fail fast)"}}
{"experiment_id": "exp_1775602777_0048", "timestamp": "2026-04-07T22:59:37.064037", "area": "system_prompt", "score": 0.7692345402638117, "quality": 0.825, "latency_ms": 5327.556550502777, "reliability": 1.0, "status": "discard", "description": "system_prompt: add explicit conciseness instruction", "mutation": {"description": "system_prompt: add explicit conciseness instruction"}}
{"experiment_id": "exp_1775603141_0049", "timestamp": "2026-04-07T23:05:41.796895", "area": "tool_descriptions", "score": 0.0, "quality": 0.0, "latency_ms": 0.0, "reliability": 0.0, "status": "crash", "description": "mutation_proposal_failed: no mutation rules registered for area 'tool_descriptions'", "mutation": {"description": "mutation_proposal_failed: no mutation rules registered for area 'tool_descriptions'"}}
{"experiment_id": "exp_1775603141_0050", "timestamp": "2026-04-07T23:05:41.833487", "area": "routing_logic", "score": 0.0, "quality": 0.0, "latency_ms": 0.0, "reliability": 0.0, "status": "crash", "description": "mutation_proposal_failed: no applicable mutations found for area 'routing_logic'", "mutation": {"description": "mutation_proposal_failed: no applicable mutations found for area 'routing_logic'"}}
{"experiment_id": "exp_1775603141_0051", "timestamp": "2026-04-07T23:05:41.865656", "area": "memory_retrieval", "score": 0.753415744331148, "quality": 0.81625, "latency_ms": 5708.033204078674, "reliability": 1.0, "status": "discard", "description": "memory: lower similarity threshold 0.75 -> 0.70 (recall more)", "mutation": {"description": "memory: lower similarity threshold 0.75 -> 0.70 (recall more)"}}
{"experiment_id": "exp_1775603521_0052", "timestamp": "2026-04-07T23:12:01.629443", "area": "voice_params", "score": 0.7715697423219681, "quality": 0.8412499999999999, "latency_ms": 5594.489276409149, "reliability": 1.0, "status": "discard", "description": "voice: smaller TTS chunks 40 -> 30 (lower latency)", "mutation": {"description": "voice: smaller TTS chunks 40 -> 30 (lower latency)"}}
{"experiment_id": "exp_1775603927_0053", "timestamp": "2026-04-07T23:18:47.020663", "area": "tool_params", "score": 0.7685770521892441, "quality": 0.825, "latency_ms": 5351.22612118721, "reliability": 1.0, "status": "discard", "description": "tools: more retries 2 -> 3", "mutation": {"description": "tools: more retries 2 -> 3"}}
{"experiment_id": "exp_1775604298_0054", "timestamp": "2026-04-07T23:24:58.835047", "area": "system_prompt", "score": 0.7558951275878483, "quality": 0.80625, "latency_ms": 5402.775406837463, "reliability": 1.0, "status": "discard", "description": "system_prompt: encourage tool-first behavior", "mutation": {"description": "system_prompt: encourage tool-first behavior"}}
{"experiment_id": "exp_1775604649_0055", "timestamp": "2026-04-07T23:30:49.730422", "area": "tool_descriptions", "score": 0.0, "quality": 0.0, "latency_ms": 0.0, "reliability": 0.0, "status": "crash", "description": "mutation_proposal_failed: no mutation rules registered for area 'tool_descriptions'", "mutation": {"description": "mutation_proposal_failed: no mutation rules registered for area 'tool_descriptions'"}}
{"experiment_id": "exp_1775604653_0056", "timestamp": "2026-04-07T23:30:53.114012", "area": "routing_logic", "score": 0.0, "quality": 0.0, "latency_ms": 0.0, "reliability": 0.0, "status": "crash", "description": "mutation_proposal_failed: no applicable mutations found for area 'routing_logic'", "mutation": {"description": "mutation_proposal_failed: no applicable mutations found for area 'routing_logic'"}}
{"experiment_id": "exp_1775604653_0057", "timestamp": "2026-04-07T23:30:53.134688", "area": "memory_retrieval", "score": 0.7857892388105392, "quality": 0.86875, "latency_ms": 5676.587402820587, "reliability": 1.0, "status": "discard", "description": "memory: increase top_k 5 -> 7", "mutation": {"description": "memory: increase top_k 5 -> 7"}}
{"experiment_id": "exp_1775604959_0058", "timestamp": "2026-04-07T23:35:59.878442", "area": "voice_params", "score": 0.7768778853217762, "quality": 0.8225, "latency_ms": 4998.396128416061, "reliability": 1.0, "status": "discard", "description": "voice: smaller TTS chunks 40 -> 30 (lower latency)", "mutation": {"description": "voice: smaller TTS chunks 40 -> 30 (lower latency)"}}
{"experiment_id": "exp_1775605191_0059", "timestamp": "2026-04-07T23:39:51.580439", "area": "tool_params", "score": 0.7838822357124753, "quality": 0.8412499999999999, "latency_ms": 5151.239514350891, "reliability": 1.0, "status": "discard", "description": "tools: tighten timeout 10s -> 8s (fail fast)", "mutation": {"description": "tools: tighten timeout 10s -> 8s (fail fast)"}}
{"experiment_id": "exp_1775605547_0060", "timestamp": "2026-04-07T23:45:47.026195", "area": "system_prompt", "score": 0.8163128866420852, "quality": 0.8875, "latency_ms": 4982.7360808849335, "reliability": 1.0, "status": "discard", "description": "system_prompt: add explicit conciseness instruction", "mutation": {"description": "system_prompt: add explicit conciseness instruction"}}
{"experiment_id": "exp_1775605875_0061", "timestamp": "2026-04-07T23:51:15.096112", "area": "tool_descriptions", "score": 0.0, "quality": 0.0, "latency_ms": 0.0, "reliability": 0.0, "status": "crash", "description": "mutation_proposal_failed: no mutation rules registered for area 'tool_descriptions'", "mutation": {"description": "mutation_proposal_failed: no mutation rules registered for area 'tool_descriptions'"}}
{"experiment_id": "exp_1775605875_0062", "timestamp": "2026-04-07T23:51:15.131858", "area": "routing_logic", "score": 0.0, "quality": 0.0, "latency_ms": 0.0, "reliability": 0.0, "status": "crash", "description": "mutation_proposal_failed: no applicable mutations found for area 'routing_logic'", "mutation": {"description": "mutation_proposal_failed: no applicable mutations found for area 'routing_logic'"}}
{"experiment_id": "exp_1775605878_0063", "timestamp": "2026-04-07T23:51:18.042880", "area": "memory_retrieval", "score": 0.7855917239851422, "quality": 0.83125, "latency_ms": 4873.697936534882, "reliability": 1.0, "status": "discard", "description": "memory: lower similarity threshold 0.75 -> 0.70 (recall more)", "mutation": {"description": "memory: lower similarity threshold 0.75 -> 0.70 (recall more)"}}
{"experiment_id": "exp_1775606197_0064", "timestamp": "2026-04-07T23:56:37.861980", "area": "voice_params", "score": 0.8056437020831637, "quality": 0.91875, "latency_ms": 6041.8267250061035, "reliability": 1.0, "status": "discard", "description": "voice: smaller TTS chunks 40 -> 30 (lower latency)", "mutation": {"description": "voice: smaller TTS chunks 40 -> 30 (lower latency)"}}
{"experiment_id": "exp_1775606519_0065", "timestamp": "2026-04-08T00:01:59.553224", "area": "tool_params", "score": 0.8190065157281028, "quality": 0.895, "latency_ms": 5047.7654337883, "reliability": 1.0, "status": "discard", "description": "tools: more retries 2 -> 3", "mutation": {"description": "tools: more retries 2 -> 3"}}
{"experiment_id": "exp_1775606895_0066", "timestamp": "2026-04-08T00:08:15.682535", "area": "system_prompt", "score": 0.7664740832580461, "quality": 0.86, "latency_ms": 6182.933002710342, "reliability": 1.0, "status": "discard", "description": "system_prompt: encourage tool-first behavior", "mutation": {"description": "system_prompt: encourage tool-first behavior"}}
{"experiment_id": "exp_1775607213_0067", "timestamp": "2026-04-08T00:13:33.509602", "area": "tool_descriptions", "score": 0.0, "quality": 0.0, "latency_ms": 0.0, "reliability": 0.0, "status": "crash", "description": "mutation_proposal_failed: no mutation rules registered for area 'tool_descriptions'", "mutation": {"description": "mutation_proposal_failed: no mutation rules registered for area 'tool_descriptions'"}}
{"experiment_id": "exp_1775607215_0068", "timestamp": "2026-04-08T00:13:35.969281", "area": "routing_logic", "score": 0.0, "quality": 0.0, "latency_ms": 0.0, "reliability": 0.0, "status": "crash", "description": "mutation_proposal_failed: no applicable mutations found for area 'routing_logic'", "mutation": {"description": "mutation_proposal_failed: no applicable mutations found for area 'routing_logic'"}}
{"experiment_id": "exp_1775607219_0069", "timestamp": "2026-04-08T00:13:39.711605", "area": "memory_retrieval", "score": 0.8396848598453734, "quality": 0.9125, "latency_ms": 4681.345045566559, "reliability": 1.0, "status": "discard", "description": "memory: increase top_k 5 -> 7", "mutation": {"description": "memory: increase top_k 5 -> 7"}}
{"experiment_id": "exp_1775607574_0070", "timestamp": "2026-04-08T00:19:34.496520", "area": "voice_params", "score": 0.8078465170595381, "quality": 0.89125, "latency_ms": 5368.525385856628, "reliability": 1.0, "status": "discard", "description": "voice: smaller TTS chunks 40 -> 30 (lower latency)", "mutation": {"description": "voice: smaller TTS chunks 40 -> 30 (lower latency)"}}
{"experiment_id": "exp_1775607918_0071", "timestamp": "2026-04-08T00:25:18.344534", "area": "tool_params", "score": 0.7446976130538516, "quality": 0.79375, "latency_ms": 5535.88593006134, "reliability": 1.0, "status": "discard", "description": "tools: tighten timeout 10s -> 8s (fail fast)", "mutation": {"description": "tools: tighten timeout 10s -> 8s (fail fast)"}}
{"experiment_id": "exp_1775608290_0072", "timestamp": "2026-04-08T00:31:30.201776", "area": "system_prompt", "score": 0.8402340236306192, "quality": 0.925, "latency_ms": 4931.575149297714, "reliability": 1.0, "status": "discard", "description": "system_prompt: add explicit conciseness instruction", "mutation": {"description": "system_prompt: add explicit conciseness instruction"}}
{"experiment_id": "exp_1775608644_0073", "timestamp": "2026-04-08T00:37:24.940941", "area": "tool_descriptions", "score": 0.0, "quality": 0.0, "latency_ms": 0.0, "reliability": 0.0, "status": "crash", "description": "mutation_proposal_failed: no mutation rules registered for area 'tool_descriptions'", "mutation": {"description": "mutation_proposal_failed: no mutation rules registered for area 'tool_descriptions'"}}
{"experiment_id": "exp_1775608648_0074", "timestamp": "2026-04-08T00:37:28.396790", "area": "routing_logic", "score": 0.0, "quality": 0.0, "latency_ms": 0.0, "reliability": 0.0, "status": "crash", "description": "mutation_proposal_failed: no applicable mutations found for area 'routing_logic'", "mutation": {"description": "mutation_proposal_failed: no applicable mutations found for area 'routing_logic'"}}
{"experiment_id": "exp_1775608648_0075", "timestamp": "2026-04-08T00:37:28.421001", "area": "memory_retrieval", "score": 0.8343025827738975, "quality": 0.9125, "latency_ms": 4875.107020139694, "reliability": 1.0, "status": "discard", "description": "memory: lower similarity threshold 0.75 -> 0.70 (recall more)", "mutation": {"description": "memory: lower similarity threshold 0.75 -> 0.70 (recall more)"}}
{"experiment_id": "exp_1775609005_0076", "timestamp": "2026-04-08T00:43:25.790952", "area": "voice_params", "score": 0.7710139702161154, "quality": 0.79, "latency_ms": 4507.497072219849, "reliability": 1.0, "status": "discard", "description": "voice: smaller TTS chunks 40 -> 30 (lower latency)", "mutation": {"description": "voice: smaller TTS chunks 40 -> 30 (lower latency)"}}
{"experiment_id": "exp_1775609388_0077", "timestamp": "2026-04-08T00:49:48.667015", "area": "tool_params", "score": 0.8259341361787584, "quality": 0.9125, "latency_ms": 5176.371097564697, "reliability": 1.0, "status": "discard", "description": "tools: more retries 2 -> 3", "mutation": {"description": "tools: more retries 2 -> 3"}}
{"experiment_id": "exp_1775609736_0078", "timestamp": "2026-04-08T00:55:36.755184", "area": "system_prompt", "score": 0.8230945744779374, "quality": 0.91875, "latency_ms": 5413.5953187942505, "reliability": 1.0, "status": "discard", "description": "system_prompt: encourage tool-first behavior", "mutation": {"description": "system_prompt: encourage tool-first behavior"}}
{"experiment_id": "exp_1775610093_0079", "timestamp": "2026-04-08T01:01:33.352810", "area": "tool_descriptions", "score": 0.0, "quality": 0.0, "latency_ms": 0.0, "reliability": 0.0, "status": "crash", "description": "mutation_proposal_failed: no mutation rules registered for area 'tool_descriptions'", "mutation": {"description": "mutation_proposal_failed: no mutation rules registered for area 'tool_descriptions'"}}
{"experiment_id": "exp_1775610093_0080", "timestamp": "2026-04-08T01:01:33.392034", "area": "routing_logic", "score": 0.0, "quality": 0.0, "latency_ms": 0.0, "reliability": 0.0, "status": "crash", "description": "mutation_proposal_failed: no applicable mutations found for area 'routing_logic'", "mutation": {"description": "mutation_proposal_failed: no applicable mutations found for area 'routing_logic'"}}
{"experiment_id": "exp_1775610093_0081", "timestamp": "2026-04-08T01:01:33.420918", "area": "memory_retrieval", "score": 0.8046993288662698, "quality": 0.91, "latency_ms": 5886.824160814285, "reliability": 1.0, "status": "discard", "description": "memory: increase top_k 5 -> 7", "mutation": {"description": "memory: increase top_k 5 -> 7"}}
{"experiment_id": "exp_1775610471_0082", "timestamp": "2026-04-08T01:07:51.379549", "area": "voice_params", "score": 0.7783458430833288, "quality": 0.85375, "latency_ms": 5620.549649000168, "reliability": 1.0, "status": "discard", "description": "voice: smaller TTS chunks 40 -> 30 (lower latency)", "mutation": {"description": "voice: smaller TTS chunks 40 -> 30 (lower latency)"}}
{"experiment_id": "exp_1775610762_0083", "timestamp": "2026-04-08T01:12:42.829986", "area": "tool_params", "score": 0.8350595984127787, "quality": 0.9412499999999999, "latency_ms": 5468.854457139969, "reliability": 1.0, "status": "discard", "description": "tools: tighten timeout 10s -> 8s (fail fast)", "mutation": {"description": "tools: tighten timeout 10s -> 8s (fail fast)"}}
{"experiment_id": "exp_1775611045_0084", "timestamp": "2026-04-08T01:17:25.376303", "area": "system_prompt", "score": 0.8349536365535524, "quality": 0.92875, "latency_ms": 5202.669084072113, "reliability": 1.0, "status": "discard", "description": "system_prompt: add explicit conciseness instruction", "mutation": {"description": "system_prompt: add explicit conciseness instruction"}}
{"experiment_id": "exp_1775611390_0085", "timestamp": "2026-04-08T01:23:10.065067", "area": "tool_descriptions", "score": 0.0, "quality": 0.0, "latency_ms": 0.0, "reliability": 0.0, "status": "crash", "description": "mutation_proposal_failed: no mutation rules registered for area 'tool_descriptions'", "mutation": {"description": "mutation_proposal_failed: no mutation rules registered for area 'tool_descriptions'"}}
{"experiment_id": "exp_1775611390_0086", "timestamp": "2026-04-08T01:23:10.097772", "area": "routing_logic", "score": 0.0, "quality": 0.0, "latency_ms": 0.0, "reliability": 0.0, "status": "crash", "description": "mutation_proposal_failed: no applicable mutations found for area 'routing_logic'", "mutation": {"description": "mutation_proposal_failed: no applicable mutations found for area 'routing_logic'"}}
{"experiment_id": "exp_1775611390_0087", "timestamp": "2026-04-08T01:23:10.130895", "area": "memory_retrieval", "score": 0.8048919106788106, "quality": 0.89125, "latency_ms": 5474.89121556282, "reliability": 1.0, "status": "discard", "description": "memory: lower similarity threshold 0.75 -> 0.70 (recall more)", "mutation": {"description": "memory: lower similarity threshold 0.75 -> 0.70 (recall more)"}}
{"experiment_id": "exp_1775611706_0088", "timestamp": "2026-04-08T01:28:26.606761", "area": "voice_params", "score": 0.8070822560787201, "quality": 0.9, "latency_ms": 5585.038781166077, "reliability": 1.0, "status": "discard", "description": "voice: smaller TTS chunks 40 -> 30 (lower latency)", "mutation": {"description": "voice: smaller TTS chunks 40 -> 30 (lower latency)"}}
{"experiment_id": "exp_1775612076_0089", "timestamp": "2026-04-08T01:34:36.398091", "area": "tool_params", "score": 0.7937240439587168, "quality": 0.86625, "latency_ms": 5336.934417486191, "reliability": 1.0, "status": "discard", "description": "tools: more retries 2 -> 3", "mutation": {"description": "tools: more retries 2 -> 3"}}
{"experiment_id": "exp_1775612374_0090", "timestamp": "2026-04-08T01:39:34.889324", "area": "system_prompt", "score": 0.6804698892368211, "quality": 0.71, "latency_ms": 6039.0839874744415, "reliability": 1.0, "status": "discard", "description": "system_prompt: encourage tool-first behavior", "mutation": {"description": "system_prompt: encourage tool-first behavior"}}
{"experiment_id": "exp_1775612784_0091", "timestamp": "2026-04-08T01:46:24.842287", "area": "tool_descriptions", "score": 0.0, "quality": 0.0, "latency_ms": 0.0, "reliability": 0.0, "status": "crash", "description": "mutation_proposal_failed: no mutation rules registered for area 'tool_descriptions'", "mutation": {"description": "mutation_proposal_failed: no mutation rules registered for area 'tool_descriptions'"}}
{"experiment_id": "exp_1775612787_0092", "timestamp": "2026-04-08T01:46:27.942819", "area": "routing_logic", "score": 0.0, "quality": 0.0, "latency_ms": 0.0, "reliability": 0.0, "status": "crash", "description": "mutation_proposal_failed: no applicable mutations found for area 'routing_logic'", "mutation": {"description": "mutation_proposal_failed: no applicable mutations found for area 'routing_logic'"}}
{"experiment_id": "exp_1775612787_0093", "timestamp": "2026-04-08T01:46:27.972004", "area": "memory_retrieval", "score": 0.8487158713075851, "quality": 0.9625, "latency_ms": 5436.228632926941, "reliability": 1.0, "status": "discard", "description": "memory: increase top_k 5 -> 7", "mutation": {"description": "memory: increase top_k 5 -> 7"}}
{"experiment_id": "exp_1775613174_0094", "timestamp": "2026-04-08T01:52:54.439251", "area": "voice_params", "score": 0.7987455970380042, "quality": 0.8625, "latency_ms": 5075.158506631851, "reliability": 1.0, "status": "discard", "description": "voice: smaller TTS chunks 40 -> 30 (lower latency)", "mutation": {"description": "voice: smaller TTS chunks 40 -> 30 (lower latency)"}}
{"experiment_id": "exp_1775613550_0095", "timestamp": "2026-04-08T01:59:10.739463", "area": "tool_params", "score": 0.787025181988875, "quality": 0.8525, "latency_ms": 5281.093448400497, "reliability": 1.0, "status": "discard", "description": "tools: tighten timeout 10s -> 8s (fail fast)", "mutation": {"description": "tools: tighten timeout 10s -> 8s (fail fast)"}}
{"experiment_id": "exp_1775613919_0096", "timestamp": "2026-04-08T02:05:19.290760", "area": "system_prompt", "score": 0.809318934208817, "quality": 0.87875, "latency_ms": 5045.51836848259, "reliability": 1.0, "status": "discard", "description": "system_prompt: add explicit conciseness instruction", "mutation": {"description": "system_prompt: add explicit conciseness instruction"}}
{"experiment_id": "exp_1775614263_0097", "timestamp": "2026-04-08T02:11:03.448895", "area": "tool_descriptions", "score": 0.0, "quality": 0.0, "latency_ms": 0.0, "reliability": 0.0, "status": "crash", "description": "mutation_proposal_failed: no mutation rules registered for area 'tool_descriptions'", "mutation": {"description": "mutation_proposal_failed: no mutation rules registered for area 'tool_descriptions'"}}
{"experiment_id": "exp_1775614263_0098", "timestamp": "2026-04-08T02:11:03.485795", "area": "routing_logic", "score": 0.0, "quality": 0.0, "latency_ms": 0.0, "reliability": 0.0, "status": "crash", "description": "mutation_proposal_failed: no applicable mutations found for area 'routing_logic'", "mutation": {"description": "mutation_proposal_failed: no applicable mutations found for area 'routing_logic'"}}
{"experiment_id": "exp_1775614263_0099", "timestamp": "2026-04-08T02:11:03.518955", "area": "memory_retrieval", "score": 0.7802266122566328, "quality": 0.8125, "latency_ms": 4661.841958761215, "reliability": 1.0, "status": "discard", "description": "memory: lower similarity threshold 0.75 -> 0.70 (recall more)", "mutation": {"description": "memory: lower similarity threshold 0.75 -> 0.70 (recall more)"}}
{"experiment_id": "exp_1775614539_0100", "timestamp": "2026-04-08T02:15:39.195977", "area": "voice_params", "score": 0.8394731940163507, "quality": 0.95625, "latency_ms": 5633.965015411377, "reliability": 1.0, "status": "discard", "description": "voice: smaller TTS chunks 40 -> 30 (lower latency)", "mutation": {"description": "voice: smaller TTS chunks 40 -> 30 (lower latency)"}}
