{"experiment_id": "exp_1776185784_0001", "timestamp": "2026-04-14T16:56:24.928738", "area": "routing_logic", "score": 0.0, "quality": 0.0, "latency_ms": 0.0, "reliability": 0.0, "status": "crash", "description": "mutation_proposal_failed: no applicable mutations found for area 'routing_logic'", "mutation": {"description": "mutation_proposal_failed: no applicable mutations found for area 'routing_logic'"}}
{"experiment_id": "exp_1776185784_0002", "timestamp": "2026-04-14T16:56:24.930355", "area": "routing_logic", "score": 0.0, "quality": 0.0, "latency_ms": 0.0, "reliability": 0.0, "status": "crash", "description": "mutation_proposal_failed: no applicable mutations found for area 'routing_logic'", "mutation": {"description": "mutation_proposal_failed: no applicable mutations found for area 'routing_logic'"}}
{"experiment_id": "exp_1776186536_0001", "timestamp": "2026-04-14T17:08:56.125862", "area": "memory_retrieval", "score": 0.7803843638499577, "quality": 0.71375, "latency_ms": 2523.16290140152, "reliability": 1.0, "status": "discard", "description": "memory: increase top_k 5 -> 7", "mutation": {"description": "memory: increase top_k 5 -> 7"}}
{"experiment_id": "exp_1776186565_0002", "timestamp": "2026-04-14T17:09:25.573519", "area": "memory_retrieval", "score": 0.7180017355216874, "quality": 0.6050000000000001, "latency_ms": 2419.9375212192535, "reliability": 1.0, "status": "discard", "description": "memory: increase top_k 5 -> 7", "mutation": {"description": "memory: increase top_k 5 -> 7"}}
{"experiment_id": "exp_1776186594_0003", "timestamp": "2026-04-14T17:09:54.929720", "area": "memory_retrieval", "score": 0.7166562680072255, "quality": 0.6062500000000001, "latency_ms": 2495.3743517398834, "reliability": 1.0, "status": "discard", "description": "memory: increase top_k 5 -> 7", "mutation": {"description": "memory: increase top_k 5 -> 7"}}
{"experiment_id": "exp_1776188369_0001", "timestamp": "2026-04-14T17:39:29.484018", "area": "tool_descriptions", "score": 0.0, "quality": 0.0, "latency_ms": 0.0, "reliability": 0.0, "status": "crash", "description": "mutation_proposal_failed: no mutation rules registered for area 'tool_descriptions'", "mutation": {"description": "mutation_proposal_failed: no mutation rules registered for area 'tool_descriptions'"}}
{"experiment_id": "exp_1776874571_0001", "timestamp": "2026-04-22T16:16:11.450308", "area": "system_prompt", "score": 0.4225, "quality": 0.037500000000000006, "latency_ms": 342.2846496105194, "reliability": 1.0, "status": "discard", "description": "system_prompt: add explicit conciseness instruction", "mutation": {"description": "system_prompt: add explicit conciseness instruction"}}
{"experiment_id": "exp_1776874588_0002", "timestamp": "2026-04-22T16:16:28.072098", "area": "memory_retrieval", "score": 0.41875, "quality": 0.03125, "latency_ms": 358.89655351638794, "reliability": 1.0, "status": "discard", "description": "memory: lower similarity threshold 0.75 -> 0.70 (recall more)", "mutation": {"description": "memory: lower similarity threshold 0.75 -> 0.70 (recall more)"}}
{"experiment_id": "exp_1776874600_0003", "timestamp": "2026-04-22T16:16:40.937091", "area": "voice_params", "score": 0.41875, "quality": 0.03125, "latency_ms": 348.30665588378906, "reliability": 1.0, "status": "discard", "description": "voice: smaller TTS chunks 40 -> 30 (lower latency)", "mutation": {"description": "voice: smaller TTS chunks 40 -> 30 (lower latency)"}}
{"experiment_id": "exp_1776874615_0004", "timestamp": "2026-04-22T16:16:55.481833", "area": "tool_params", "score": 0.41875, "quality": 0.03125, "latency_ms": 367.3262596130371, "reliability": 1.0, "status": "discard", "description": "tools: more retries 2 -> 3", "mutation": {"description": "tools: more retries 2 -> 3"}}
{"experiment_id": "exp_1776874628_0005", "timestamp": "2026-04-22T16:17:08.460231", "area": "system_prompt", "score": 0.4225, "quality": 0.037500000000000006, "latency_ms": 425.5006015300751, "reliability": 1.0, "status": "discard", "description": "system_prompt: encourage tool-first behavior", "mutation": {"description": "system_prompt: encourage tool-first behavior"}}
{"experiment_id": "exp_1776874882_0001", "timestamp": "2026-04-22T16:21:22.015981", "area": "system_prompt", "score": 0.2425, "quality": 0.2375, "latency_ms": 19420.18961906433, "reliability": 0.5, "status": "discard", "description": "system_prompt: add explicit conciseness instruction", "mutation": {"description": "system_prompt: add explicit conciseness instruction"}}
{"experiment_id": "exp_1776875112_0002", "timestamp": "2026-04-22T16:25:12.093673", "area": "memory_retrieval", "score": 0.3125, "quality": 0.3125, "latency_ms": 21734.46875810623, "reliability": 0.625, "status": "discard", "description": "memory: increase top_k 5 -> 7", "mutation": {"description": "memory: increase top_k 5 -> 7"}}
{"experiment_id": "exp_1776875395_0003", "timestamp": "2026-04-22T16:29:55.898957", "area": "voice_params", "score": 0.135, "quality": 0.1, "latency_ms": 22322.899013757706, "reliability": 0.375, "status": "discard", "description": "voice: smaller TTS chunks 40 -> 30 (lower latency)", "mutation": {"description": "voice: smaller TTS chunks 40 -> 30 (lower latency)"}}
{"experiment_id": "exp_1776875661_0004", "timestamp": "2026-04-22T16:34:21.488817", "area": "tool_params", "score": 0.05, "quality": 0.0, "latency_ms": 22602.58850455284, "reliability": 0.25, "status": "discard", "description": "tools: tighten timeout 10s -> 8s (fail fast)", "mutation": {"description": "tools: tighten timeout 10s -> 8s (fail fast)"}}
{"experiment_id": "exp_1776875880_0005", "timestamp": "2026-04-22T16:38:00.357017", "area": "system_prompt", "score": 0.15000000000000002, "quality": 0.125, "latency_ms": 22728.57740521431, "reliability": 0.375, "status": "discard", "description": "system_prompt: add explicit conciseness instruction", "mutation": {"description": "system_prompt: add explicit conciseness instruction"}}
{"experiment_id": "exp_1777198893_0001", "timestamp": "2026-04-26T10:21:33.104793", "area": "system_prompt", "score": 0.0, "quality": 0.0, "latency_ms": 0.0, "reliability": 0.0, "status": "crash", "description": "benchmark_crashed: TanishiBrain not importable: No module named 'pydantic_settings'", "mutation": {"description": "benchmark_crashed: TanishiBrain not importable: No module named 'pydantic_settings'"}}
{"experiment_id": "exp_1777198893_0002", "timestamp": "2026-04-26T10:21:33.109632", "area": "memory_retrieval", "score": 0.0, "quality": 0.0, "latency_ms": 0.0, "reliability": 0.0, "status": "crash", "description": "benchmark_crashed: TanishiBrain not importable: No module named 'pydantic_settings'", "mutation": {"description": "benchmark_crashed: TanishiBrain not importable: No module named 'pydantic_settings'"}}
{"experiment_id": "exp_1777198893_0003", "timestamp": "2026-04-26T10:21:33.112409", "area": "voice_params", "score": 0.0, "quality": 0.0, "latency_ms": 0.0, "reliability": 0.0, "status": "crash", "description": "benchmark_crashed: TanishiBrain not importable: No module named 'pydantic_settings'", "mutation": {"description": "benchmark_crashed: TanishiBrain not importable: No module named 'pydantic_settings'"}}
{"experiment_id": "exp_1777199311_0001", "timestamp": "2026-04-26T10:28:31.192813", "area": "system_prompt", "score": 0.6709681729144521, "quality": 0.70625, "latency_ms": 6300.145775079727, "reliability": 1.0, "status": "discard", "description": "system_prompt: encourage tool-first behavior", "mutation": {"description": "system_prompt: encourage tool-first behavior"}}
{"experiment_id": "exp_1777199373_0002", "timestamp": "2026-04-26T10:29:33.740205", "area": "memory_retrieval", "score": 0.7806147847241827, "quality": 0.8250000000000001, "latency_ms": 4917.867749929428, "reliability": 1.0, "status": "discard", "description": "memory: lower similarity threshold 0.75 -> 0.70 (recall more)", "mutation": {"description": "memory: lower similarity threshold 0.75 -> 0.70 (recall more)"}}
{"experiment_id": "exp_1777199419_0003", "timestamp": "2026-04-26T10:30:19.575920", "area": "voice_params", "score": 0.6539501017332078, "quality": 0.6937500000000001, "latency_ms": 6642.796337604523, "reliability": 1.0, "status": "discard", "description": "voice: smaller TTS chunks 40 -> 30 (lower latency)", "mutation": {"description": "voice: smaller TTS chunks 40 -> 30 (lower latency)"}}
{"experiment_id": "exp_1777235300_0001", "timestamp": "2026-04-26T20:28:20.658931", "area": "memory_retrieval", "score": 0.7048498345812162, "quality": 0.6212499999999999, "latency_ms": 3244.4059550762177, "reliability": 1.0, "status": "discard", "description": "memory: increase top_k 7 -> 9", "mutation": {"description": "memory: increase top_k 7 -> 9"}}
{"experiment_id": "exp_1777235341_0002", "timestamp": "2026-04-26T20:29:01.615592", "area": "tool_params", "score": 0.6416448081599342, "quality": 0.6525, "latency_ms": 6194.786906242371, "reliability": 1.0, "status": "discard", "description": "tools: more retries 2 -> 3", "mutation": {"description": "tools: more retries 2 -> 3"}}
{"experiment_id": "exp_1777235439_0003", "timestamp": "2026-04-26T20:30:39.107060", "area": "tool_params", "score": 0.6720191857616107, "quality": 0.7024999999999999, "latency_ms": 6181.309312582016, "reliability": 1.0, "status": "discard", "description": "tools: tighten timeout 10s -> 8s (fail fast)", "mutation": {"description": "tools: tighten timeout 10s -> 8s (fail fast)"}}
{"experiment_id": "exp_1777294329_0001", "timestamp": "2026-04-27T12:52:09.572987", "area": "scoring_weights", "score": 0.1, "quality": 0.0, "latency_ms": 0.06836652755737305, "reliability": 0.0, "status": "discard", "description": "scoring_weights: rebalance quality/latency/reliability -> 0.60/0.10/0.30", "mutation": {"description": "scoring_weights: rebalance quality/latency/reliability -> 0.60/0.10/0.30"}}
{"experiment_id": "exp_1777294329_0002", "timestamp": "2026-04-27T12:52:09.619912", "area": "scoring_weights", "score": 0.15, "quality": 0.0, "latency_ms": 0.051915645599365234, "reliability": 0.0, "status": "discard", "description": "scoring_weights: rebalance quality/latency/reliability -> 0.70/0.15/0.15", "mutation": {"description": "scoring_weights: rebalance quality/latency/reliability -> 0.70/0.15/0.15"}}
{"experiment_id": "exp_1777294380_0001", "timestamp": "2026-04-27T12:53:00.437047", "area": "mutation_rules", "score": 0.7437499999999999, "quality": 0.90625, "latency_ms": 12158.222615718842, "reliability": 1.0, "status": "discard", "description": "mutation_rules: add dynamic rule for system_prompt \u2014 Introduce a blended prompt style, balancing tool-first with a more conversational and detailed system prompt.", "mutation": {"description": "mutation_rules: add dynamic rule for system_prompt \u2014 Introduce a blended prompt style, balancing tool-first with a more conversational and detailed system prompt."}}
{"experiment_id": "exp_1777294506_0002", "timestamp": "2026-04-27T12:55:06.073522", "area": "mutation_rules", "score": 0.66875, "quality": 0.78125, "latency_ms": 12940.456479787827, "reliability": 1.0, "status": "discard", "description": "mutation_rules: add dynamic rule for system_prompt \u2014 Introduce a nuanced prompt that prioritizes both tool usage and conversational flow, mitigating the negative effects of overly aggressive 'tool-first' directives.", "mutation": {"description": "mutation_rules: add dynamic rule for system_prompt \u2014 Introduce a nuanced prompt that prioritizes both tool usage and conversational flow, mitigating the negative effects of overly aggressive 'tool-first' directives."}}
{"experiment_id": "exp_1777294664_0001", "timestamp": "2026-04-27T12:57:44.459356", "area": "scoring_weights", "score": 0.6656250000000001, "quality": 0.8312500000000002, "latency_ms": 13175.369083881378, "reliability": 1.0, "status": "discard", "description": "scoring_weights: rebalance quality/latency/reliability -> 0.50/0.25/0.25", "mutation": {"description": "scoring_weights: rebalance quality/latency/reliability -> 0.50/0.25/0.25"}}
