{"experiment_id": "baseline_1775560366", "timestamp": "2026-04-07T11:12:46.320974", "area": "baseline", "score": 0.6933941892849075, "quality": 0.69625, "latency_ms": 5276.809185743332, "reliability": 1.0, "status": "keep", "description": "initial baseline", "mutation": {"description": "baseline", "diff": null}}
{"experiment_id": "exp_1775560366_0001", "timestamp": "2026-04-07T11:12:46.322723", "area": "tool_descriptions", "score": 0.0, "quality": 0.0, "latency_ms": 0.0, "reliability": 0.0, "status": "crash", "description": "mutation_proposal_failed: no mutation rules registered for area 'tool_descriptions'", "mutation": {"description": "mutation_proposal_failed: no mutation rules registered for area 'tool_descriptions'"}}
{"experiment_id": "exp_1775560366_0002", "timestamp": "2026-04-07T11:12:46.334831", "area": "routing_logic", "score": 0.7100060973299873, "quality": 0.6962499999999999, "latency_ms": 4678.780496120453, "reliability": 1.0, "status": "keep", "description": "routing: use Haiku for simple queries (faster + cheaper)", "mutation": {"description": "routing: use Haiku for simple queries (faster + cheaper)"}}
{"experiment_id": "exp_1775560419_0003", "timestamp": "2026-04-07T11:13:39.794613", "area": "memory_retrieval", "score": 0.706540181338787, "quality": 0.69375, "latency_ms": 4749.553471803665, "reliability": 1.0, "status": "discard", "description": "memory: lower similarity threshold 0.75 -> 0.70 (recall more)", "mutation": {"description": "memory: lower similarity threshold 0.75 -> 0.70 (recall more)"}}
{"experiment_id": "exp_1775590747_0001", "timestamp": "2026-04-07T19:39:07.593559", "area": "tool_descriptions", "score": 0.0, "quality": 0.0, "latency_ms": 0.0, "reliability": 0.0, "status": "crash", "description": "mutation_proposal_failed: no mutation rules registered for area 'tool_descriptions'", "mutation": {"description": "mutation_proposal_failed: no mutation rules registered for area 'tool_descriptions'"}}
{"experiment_id": "exp_1775590747_0002", "timestamp": "2026-04-07T19:39:07.615190", "area": "routing_logic", "score": 0.6019014358586735, "quality": 0.59, "latency_ms": 6275.548309087753, "reliability": 1.0, "status": "discard", "description": "routing: try Ollama first for greetings/chitchat", "mutation": {"description": "routing: try Ollama first for greetings/chitchat"}}
{"experiment_id": "exp_1775591136_0001", "timestamp": "2026-04-07T19:45:36.918208", "area": "tool_descriptions", "score": 0.0, "quality": 0.0, "latency_ms": 0.0, "reliability": 0.0, "status": "crash", "description": "mutation_proposal_failed: no mutation rules registered for area 'tool_descriptions'", "mutation": {"description": "mutation_proposal_failed: no mutation rules registered for area 'tool_descriptions'"}}
{"experiment_id": "exp_1775591136_0002", "timestamp": "2026-04-07T19:45:36.948292", "area": "routing_logic", "score": 0.6592201210127937, "quality": 0.63375, "latency_ms": 5157.075643539429, "reliability": 1.0, "status": "discard", "description": "routing: try Ollama first for greetings/chitchat", "mutation": {"description": "routing: try Ollama first for greetings/chitchat"}}
{"experiment_id": "exp_1775591600_0001", "timestamp": "2026-04-07T19:53:20.165071", "area": "tool_descriptions", "score": 0.0, "quality": 0.0, "latency_ms": 0.0, "reliability": 0.0, "status": "crash", "description": "mutation_proposal_failed: no mutation rules registered for area 'tool_descriptions'", "mutation": {"description": "mutation_proposal_failed: no mutation rules registered for area 'tool_descriptions'"}}
{"experiment_id": "exp_1775591600_0002", "timestamp": "2026-04-07T19:53:20.194811", "area": "routing_logic", "score": 0.6693696228000854, "quality": 0.65, "latency_ms": 5142.69357919693, "reliability": 1.0, "status": "discard", "description": "routing: try Ollama first for greetings/chitchat", "mutation": {"description": "routing: try Ollama first for greetings/chitchat"}}
{"experiment_id": "exp_1775591859_0001", "timestamp": "2026-04-07T19:57:39.996902", "area": "tool_descriptions", "score": 0.0, "quality": 0.0, "latency_ms": 0.0, "reliability": 0.0, "status": "crash", "description": "mutation_proposal_failed: no mutation rules registered for area 'tool_descriptions'", "mutation": {"description": "mutation_proposal_failed: no mutation rules registered for area 'tool_descriptions'"}}
{"experiment_id": "exp_1775591860_0002", "timestamp": "2026-04-07T19:57:40.032624", "area": "routing_logic", "score": 0.7836112644275031, "quality": 0.85, "latency_ms": 5349.994480609894, "reliability": 1.0, "status": "keep", "description": "routing: try Ollama first for greetings/chitchat", "mutation": {"description": "routing: try Ollama first for greetings/chitchat"}}
{"experiment_id": "exp_1775592356_0001", "timestamp": "2026-04-07T20:05:56.922119", "area": "tool_descriptions", "score": 0.0, "quality": 0.0, "latency_ms": 0.0, "reliability": 0.0, "status": "crash", "description": "mutation_proposal_failed: no mutation rules registered for area 'tool_descriptions'", "mutation": {"description": "mutation_proposal_failed: no mutation rules registered for area 'tool_descriptions'"}}
{"experiment_id": "exp_1775592356_0002", "timestamp": "2026-04-07T20:05:56.946242", "area": "routing_logic", "score": 0.0, "quality": 0.0, "latency_ms": 0.0, "reliability": 0.0, "status": "crash", "description": "mutation_proposal_failed: no applicable mutations found for area 'routing_logic'", "mutation": {"description": "mutation_proposal_failed: no applicable mutations found for area 'routing_logic'"}}
{"experiment_id": "exp_1775592356_0003", "timestamp": "2026-04-07T20:05:56.982130", "area": "memory_retrieval", "score": 0.783623611456818, "quality": 0.82875, "latency_ms": 4890.54998755455, "reliability": 1.0, "status": "discard", "description": "memory: lower similarity threshold 0.75 -> 0.70 (recall more)", "mutation": {"description": "memory: lower similarity threshold 0.75 -> 0.70 (recall more)"}}
{"experiment_id": "exp_1775592720_0004", "timestamp": "2026-04-07T20:12:00.224025", "area": "voice_params", "score": 0.8550429283910326, "quality": 0.94375, "latency_ms": 4803.454577922821, "reliability": 1.0, "status": "keep", "description": "voice: smaller TTS chunks 50 -> 40 (lower latency)", "mutation": {"description": "voice: smaller TTS chunks 50 -> 40 (lower latency)"}}
{"experiment_id": "exp_1775593044_0005", "timestamp": "2026-04-07T20:17:24.024930", "area": "tool_params", "score": 0.8351784923606449, "quality": 0.90375, "latency_ms": 4654.574275016785, "reliability": 1.0, "status": "discard", "description": "tools: more retries 1 -> 2", "mutation": {"description": "tools: more retries 1 -> 2"}}
{"experiment_id": "exp_1775593416_0006", "timestamp": "2026-04-07T20:23:36.313998", "area": "system_prompt", "score": 0.7195058358046744, "quality": 0.775, "latency_ms": 6037.789911031723, "reliability": 1.0, "status": "discard", "description": "system_prompt: encourage tool-first behavior", "mutation": {"description": "system_prompt: encourage tool-first behavior"}}
{"experiment_id": "exp_1775593724_0007", "timestamp": "2026-04-07T20:28:44.211494", "area": "tool_descriptions", "score": 0.0, "quality": 0.0, "latency_ms": 0.0, "reliability": 0.0, "status": "crash", "description": "mutation_proposal_failed: no mutation rules registered for area 'tool_descriptions'", "mutation": {"description": "mutation_proposal_failed: no mutation rules registered for area 'tool_descriptions'"}}
{"experiment_id": "exp_1775593724_0008", "timestamp": "2026-04-07T20:28:44.261442", "area": "routing_logic", "score": 0.0, "quality": 0.0, "latency_ms": 0.0, "reliability": 0.0, "status": "crash", "description": "mutation_proposal_failed: no applicable mutations found for area 'routing_logic'", "mutation": {"description": "mutation_proposal_failed: no applicable mutations found for area 'routing_logic'"}}
{"experiment_id": "exp_1775593724_0009", "timestamp": "2026-04-07T20:28:44.303206", "area": "memory_retrieval", "score": 0.8059481775760651, "quality": 0.88125, "latency_ms": 5220.865607261658, "reliability": 1.0, "status": "discard", "description": "memory: increase top_k 5 -> 7", "mutation": {"description": "memory: increase top_k 5 -> 7"}}
{"experiment_id": "exp_1775593996_0010", "timestamp": "2026-04-07T20:33:16.953330", "area": "voice_params", "score": 0.8500905536943011, "quality": 0.9375, "latency_ms": 4846.7400670051575, "reliability": 1.0, "status": "discard", "description": "voice: smaller TTS chunks 40 -> 30 (lower latency)", "mutation": {"description": "voice: smaller TTS chunks 40 -> 30 (lower latency)"}}
{"experiment_id": "exp_1775594299_0011", "timestamp": "2026-04-07T20:38:19.055882", "area": "tool_params", "score": 0.7623363937868013, "quality": 0.79125, "latency_ms": 4846.889823675156, "reliability": 1.0, "status": "discard", "description": "tools: tighten timeout 10s -> 8s (fail fast)", "mutation": {"description": "tools: tighten timeout 10s -> 8s (fail fast)"}}
{"experiment_id": "exp_1775594662_0012", "timestamp": "2026-04-07T20:44:22.062734", "area": "system_prompt", "score": 0.7670532125234604, "quality": 0.83125, "latency_ms": 5541.084349155426, "reliability": 1.0, "status": "discard", "description": "system_prompt: add explicit conciseness instruction", "mutation": {"description": "system_prompt: add explicit conciseness instruction"}}
{"experiment_id": "exp_1775595006_0013", "timestamp": "2026-04-07T20:50:06.960431", "area": "tool_descriptions", "score": 0.0, "quality": 0.0, "latency_ms": 0.0, "reliability": 0.0, "status": "crash", "description": "mutation_proposal_failed: no mutation rules registered for area 'tool_descriptions'", "mutation": {"description": "mutation_proposal_failed: no mutation rules registered for area 'tool_descriptions'"}}
{"experiment_id": "exp_1775595007_0014", "timestamp": "2026-04-07T20:50:07.022101", "area": "routing_logic", "score": 0.0, "quality": 0.0, "latency_ms": 0.0, "reliability": 0.0, "status": "crash", "description": "mutation_proposal_failed: no applicable mutations found for area 'routing_logic'", "mutation": {"description": "mutation_proposal_failed: no applicable mutations found for area 'routing_logic'"}}
{"experiment_id": "exp_1775595012_0015", "timestamp": "2026-04-07T20:50:12.875151", "area": "memory_retrieval", "score": 0.8157976916829746, "quality": 0.89, "latency_ms": 5055.283099412918, "reliability": 1.0, "status": "discard", "description": "memory: lower similarity threshold 0.75 -> 0.70 (recall more)", "mutation": {"description": "memory: lower similarity threshold 0.75 -> 0.70 (recall more)"}}
{"experiment_id": "exp_1775595378_0016", "timestamp": "2026-04-07T20:56:18.627715", "area": "voice_params", "score": 0.7748650723364618, "quality": 0.825, "latency_ms": 5124.857395887375, "reliability": 1.0, "status": "discard", "description": "voice: smaller TTS chunks 40 -> 30 (lower latency)", "mutation": {"description": "voice: smaller TTS chunks 40 -> 30 (lower latency)"}}
{"experiment_id": "exp_1775595736_0017", "timestamp": "2026-04-07T21:02:16.192136", "area": "tool_params", "score": 0.825021278063456, "quality": 0.91875, "latency_ms": 5344.233989715576, "reliability": 1.0, "status": "discard", "description": "tools: more retries 1 -> 2", "mutation": {"description": "tools: more retries 1 -> 2"}}
{"experiment_id": "exp_1775596080_0018", "timestamp": "2026-04-07T21:08:00.703358", "area": "system_prompt", "score": 0.8012333182824982, "quality": 0.875, "latency_ms": 5255.600541830063, "reliability": 1.0, "status": "discard", "description": "system_prompt: encourage tool-first behavior", "mutation": {"description": "system_prompt: encourage tool-first behavior"}}
{"experiment_id": "exp_1775596396_0019", "timestamp": "2026-04-07T21:13:16.272435", "area": "tool_descriptions", "score": 0.0, "quality": 0.0, "latency_ms": 0.0, "reliability": 0.0, "status": "crash", "description": "mutation_proposal_failed: no mutation rules registered for area 'tool_descriptions'", "mutation": {"description": "mutation_proposal_failed: no mutation rules registered for area 'tool_descriptions'"}}
{"experiment_id": "exp_1775596396_0020", "timestamp": "2026-04-07T21:13:16.305256", "area": "routing_logic", "score": 0.0, "quality": 0.0, "latency_ms": 0.0, "reliability": 0.0, "status": "crash", "description": "mutation_proposal_failed: no applicable mutations found for area 'routing_logic'", "mutation": {"description": "mutation_proposal_failed: no applicable mutations found for area 'routing_logic'"}}
{"experiment_id": "exp_1775596396_0021", "timestamp": "2026-04-07T21:13:16.337165", "area": "memory_retrieval", "score": 0.7453551339639557, "quality": 0.795, "latency_ms": 5539.215177297592, "reliability": 1.0, "status": "discard", "description": "memory: increase top_k 5 -> 7", "mutation": {"description": "memory: increase top_k 5 -> 7"}}
{"experiment_id": "exp_1775596748_0022", "timestamp": "2026-04-07T21:19:08.508404", "area": "voice_params", "score": 0.8357974336213536, "quality": 0.9, "latency_ms": 4551.292389631271, "reliability": 1.0, "status": "discard", "description": "voice: smaller TTS chunks 40 -> 30 (lower latency)", "mutation": {"description": "voice: smaller TTS chunks 40 -> 30 (lower latency)"}}
{"experiment_id": "exp_1775597089_0023", "timestamp": "2026-04-07T21:24:49.362954", "area": "tool_params", "score": 0.8237134426434836, "quality": 0.8975, "latency_ms": 4932.316064834595, "reliability": 1.0, "status": "discard", "description": "tools: tighten timeout 10s -> 8s (fail fast)", "mutation": {"description": "tools: tighten timeout 10s -> 8s (fail fast)"}}
{"experiment_id": "exp_1775597417_0024", "timestamp": "2026-04-07T21:30:17.350902", "area": "system_prompt", "score": 0.7811729408568806, "quality": 0.8099999999999999, "latency_ms": 4573.774129152298, "reliability": 1.0, "status": "discard", "description": "system_prompt: add explicit conciseness instruction", "mutation": {"description": "system_prompt: add explicit conciseness instruction"}}
{"experiment_id": "exp_1775597740_0025", "timestamp": "2026-04-07T21:35:40.131960", "area": "tool_descriptions", "score": 0.0, "quality": 0.0, "latency_ms": 0.0, "reliability": 0.0, "status": "crash", "description": "mutation_proposal_failed: no mutation rules registered for area 'tool_descriptions'", "mutation": {"description": "mutation_proposal_failed: no mutation rules registered for area 'tool_descriptions'"}}
{"experiment_id": "exp_1775597742_0026", "timestamp": "2026-04-07T21:35:42.658646", "area": "routing_logic", "score": 0.0, "quality": 0.0, "latency_ms": 0.0, "reliability": 0.0, "status": "crash", "description": "mutation_proposal_failed: no applicable mutations found for area 'routing_logic'", "mutation": {"description": "mutation_proposal_failed: no applicable mutations found for area 'routing_logic'"}}
{"experiment_id": "exp_1775597742_0027", "timestamp": "2026-04-07T21:35:42.683918", "area": "memory_retrieval", "score": 0.848870601978567, "quality": 0.935, "latency_ms": 4836.658328771591, "reliability": 1.0, "status": "discard", "description": "memory: lower similarity threshold 0.75 -> 0.70 (recall more)", "mutation": {"description": "memory: lower similarity threshold 0.75 -> 0.70 (recall more)"}}
{"experiment_id": "exp_1775598091_0028", "timestamp": "2026-04-07T21:41:31.785382", "area": "voice_params", "score": 0.7767500766846869, "quality": 0.82125, "latency_ms": 4975.997239351273, "reliability": 1.0, "status": "discard", "description": "voice: smaller TTS chunks 40 -> 30 (lower latency)", "mutation": {"description": "voice: smaller TTS chunks 40 -> 30 (lower latency)"}}
{"experiment_id": "exp_1775598398_0029", "timestamp": "2026-04-07T21:46:38.313588", "area": "tool_params", "score": 0.8224818294578127, "quality": 0.85625, "latency_ms": 4085.654139518738, "reliability": 1.0, "status": "discard", "description": "tools: more retries 1 -> 2", "mutation": {"description": "tools: more retries 1 -> 2"}}
{"experiment_id": "exp_1775598703_0030", "timestamp": "2026-04-07T21:51:43.971763", "area": "system_prompt", "score": 0.7866796130537987, "quality": 0.835, "latency_ms": 4915.533930063248, "reliability": 1.0, "status": "discard", "description": "system_prompt: encourage tool-first behavior", "mutation": {"description": "system_prompt: encourage tool-first behavior"}}
{"experiment_id": "exp_1775599016_0031", "timestamp": "2026-04-07T21:56:56.153092", "area": "tool_descriptions", "score": 0.0, "quality": 0.0, "latency_ms": 0.0, "reliability": 0.0, "status": "crash", "description": "mutation_proposal_failed: no mutation rules registered for area 'tool_descriptions'", "mutation": {"description": "mutation_proposal_failed: no mutation rules registered for area 'tool_descriptions'"}}
{"experiment_id": "exp_1775599019_0032", "timestamp": "2026-04-07T21:56:59.183653", "area": "routing_logic", "score": 0.0, "quality": 0.0, "latency_ms": 0.0, "reliability": 0.0, "status": "crash", "description": "mutation_proposal_failed: no applicable mutations found for area 'routing_logic'", "mutation": {"description": "mutation_proposal_failed: no applicable mutations found for area 'routing_logic'"}}
{"experiment_id": "exp_1775599022_0033", "timestamp": "2026-04-07T21:57:02.269515", "area": "memory_retrieval", "score": 0.8132499449451764, "quality": 0.8937499999999999, "latency_ms": 5228.001981973648, "reliability": 1.0, "status": "discard", "description": "memory: increase top_k 5 -> 7", "mutation": {"description": "memory: increase top_k 5 -> 7"}}
{"experiment_id": "exp_1775599417_0034", "timestamp": "2026-04-07T22:03:37.071161", "area": "voice_params", "score": 0.7890911089976629, "quality": 0.885, "latency_ms": 5908.720076084137, "reliability": 1.0, "status": "discard", "description": "voice: smaller TTS chunks 40 -> 30 (lower latency)", "mutation": {"description": "voice: smaller TTS chunks 40 -> 30 (lower latency)"}}
{"experiment_id": "exp_1775599707_0035", "timestamp": "2026-04-07T22:08:27.429332", "area": "tool_params", "score": 0.8218293790022533, "quality": 0.9, "latency_ms": 5054.142355918884, "reliability": 1.0, "status": "discard", "description": "tools: tighten timeout 10s -> 8s (fail fast)", "mutation": {"description": "tools: tighten timeout 10s -> 8s (fail fast)"}}
{"experiment_id": "exp_1775600035_0036", "timestamp": "2026-04-07T22:13:55.794688", "area": "system_prompt", "score": 0.8067352069417635, "quality": 0.89375, "latency_ms": 5462.532550096512, "reliability": 1.0, "status": "discard", "description": "system_prompt: add explicit conciseness instruction", "mutation": {"description": "system_prompt: add explicit conciseness instruction"}}
{"experiment_id": "exp_1775600411_0037", "timestamp": "2026-04-07T22:20:11.360165", "area": "tool_descriptions", "score": 0.0, "quality": 0.0, "latency_ms": 0.0, "reliability": 0.0, "status": "crash", "description": "mutation_proposal_failed: no mutation rules registered for area 'tool_descriptions'", "mutation": {"description": "mutation_proposal_failed: no mutation rules registered for area 'tool_descriptions'"}}
{"experiment_id": "exp_1775600411_0038", "timestamp": "2026-04-07T22:20:11.399486", "area": "routing_logic", "score": 0.0, "quality": 0.0, "latency_ms": 0.0, "reliability": 0.0, "status": "crash", "description": "mutation_proposal_failed: no applicable mutations found for area 'routing_logic'", "mutation": {"description": "mutation_proposal_failed: no applicable mutations found for area 'routing_logic'"}}
{"experiment_id": "exp_1775600411_0039", "timestamp": "2026-04-07T22:20:11.431123", "area": "memory_retrieval", "score": 0.7446147394114071, "quality": 0.7975, "latency_ms": 5619.869381189346, "reliability": 1.0, "status": "discard", "description": "memory: lower similarity threshold 0.75 -> 0.70 (recall more)", "mutation": {"description": "memory: lower similarity threshold 0.75 -> 0.70 (recall more)"}}
{"experiment_id": "exp_1775600756_0040", "timestamp": "2026-04-07T22:25:56.124005", "area": "voice_params", "score": 0.7888961974713538, "quality": 0.84125, "latency_ms": 4970.736891031265, "reliability": 1.0, "status": "discard", "description": "voice: smaller TTS chunks 40 -> 30 (lower latency)", "mutation": {"description": "voice: smaller TTS chunks 40 -> 30 (lower latency)"}}
{"experiment_id": "exp_1775601120_0041", "timestamp": "2026-04-07T22:32:00.047752", "area": "tool_params", "score": 0.85626852244801, "quality": 0.92125, "latency_ms": 4273.333191871643, "reliability": 1.0, "status": "keep", "description": "tools: more retries 1 -> 2", "mutation": {"description": "tools: more retries 1 -> 2"}}
{"experiment_id": "exp_1775601457_0042", "timestamp": "2026-04-07T22:37:37.418047", "area": "system_prompt", "score": 0.8295954860912429, "quality": 0.94375, "latency_ms": 5719.562500715256, "reliability": 1.0, "status": "discard", "description": "system_prompt: encourage tool-first behavior", "mutation": {"description": "system_prompt: encourage tool-first behavior"}}
{"experiment_id": "exp_1775601753_0043", "timestamp": "2026-04-07T22:42:33.551877", "area": "tool_descriptions", "score": 0.0, "quality": 0.0, "latency_ms": 0.0, "reliability": 0.0, "status": "crash", "description": "mutation_proposal_failed: no mutation rules registered for area 'tool_descriptions'", "mutation": {"description": "mutation_proposal_failed: no mutation rules registered for area 'tool_descriptions'"}}
{"experiment_id": "exp_1775601757_0044", "timestamp": "2026-04-07T22:42:37.274464", "area": "routing_logic", "score": 0.0, "quality": 0.0, "latency_ms": 0.0, "reliability": 0.0, "status": "crash", "description": "mutation_proposal_failed: no applicable mutations found for area 'routing_logic'", "mutation": {"description": "mutation_proposal_failed: no applicable mutations found for area 'routing_logic'"}}
