experiment_id	timestamp	area	score	quality	latency_ms	reliability	status	description
exp_1777294506_0002	2026-04-27T12:55:06.073522	mutation_rules	0.668750	0.7812	12940	1.0000	discard	mutation_rules: add dynamic rule for system_prompt — Introduce a nuanced prompt that prioritizes both tool usage and conversational flow, mitigating the negative effects of overly aggressive 'tool-fir
exp_1777294664_0001	2026-04-27T12:57:44.459356	scoring_weights	0.665625	0.8313	13175	1.0000	discard	scoring_weights: rebalance quality/latency/reliability -> 0.50/0.25/0.25
